{
  "organizerId": "AbCdEfGhIjKlMnOpQr12",
  "name": "Race Course Event Collective",
  "description": "Social Indore events for easy kilometres and coffee stops.",
  "location": "in-mp-indore",
  "area": "Race Course Road",
  "imageUrl": null,
  "profileImageUrl": null,
  "instagramHandle": "racecourseevents",
  "phoneNumber": "+918800000001",
  "email": "race.course@example.test"
}
